{
  "$schema": "../../../schemas/app.manifest.schema.json",
  "schemaVersion": 2,
  "slug": "safroidvision",
  "name": "SafroID (vision)",
  "shortDescription": "Identité décentralisée (DID) et profil unifié — décrite dans la documentation produit de l'écosystème.",
  "description": "La vision SafroID couvre pseudo, avatar, bio et liens sociaux vérifiables, avec intégration prévue aux applications Safrochain. Elle correspond au besoin d'identité portable évoqué sur le site et dans les docs hub, distinct d'une simple adresse wallet.",
  "url": "https://docs.safrochain.com",
  "status": "beta",
  "chains": [
    "safrod-mainnet"
  ],
  "category": "social",
  "tags": [
    "did",
    "profile",
    "vision"
  ],
  "submittedAt": "2026-04-06",
  "updatedAt": "2026-04-06",
  "statusNote": "Listed as upcoming or roadmap on official sources; not live yet.",
  "links": {
    "x": "https://twitter.com/safrochain",
    "docs": "https://docs.safrochain.com"
  }
}
