{
  "$schema": "../../../schemas/app.manifest.schema.json",
  "schemaVersion": 2,
  "slug": "safrochaincom",
  "name": "Safrochain.com",
  "shortDescription": "Site officiel : vision Africa-first, tokenomics, roadmap, FAQ, statut réseau et liens vers l'écosystème.",
  "description": "Le site safrochain.com présente la couche Cosmos SDK, l'interopérabilité IBC, les frais sub-cent et les cas d'usage (remises, micro-paiements, épargne). Vous y trouvez la roadmap (mainnet visé Q3 2026), les ressources (whitepaper, brand assets) et les accès développeurs (documentation, explorer, faucet).",
  "url": "https://www.safrochain.com/",
  "status": "live",
  "chains": [
    "safrod-mainnet"
  ],
  "category": "infrastructure",
  "tags": [
    "official",
    "roadmap",
    "token-saf",
    "featured"
  ],
  "submittedAt": "2026-04-06",
  "updatedAt": "2026-04-06",
  "launchDate": "2024-01-01",
  "links": {
    "x": "https://twitter.com/safrochain",
    "docs": "https://docs.safrochain.com"
  }
}
